pmid,title,abstract,year,journal,doi,authors
41126447,Hospitalisation Risk Among Danish Older Adults Receiving Municipality Care: An Integrative Review.,"Denmark's increasing elderly population with multiple chronic diseases calls for special attention regarding the risk of hospitalisation. This review aims to address the characteristics of this population and their antecedents with hospitalisation, contributing to the development of tailored interventions that could improve health outcomes and reduce preventable hospitalisations in this vulnerable population.",2025,Scandinavian journal of caring sciences,10.1111/scs.70138,Connie Berthelsen; Mia Ingerslev Loft
41125281,Evaluating home-based personalised virtual reality physiotherapy rehabilitation compared with usual care in the treatment of pain for people with knee osteoarthritis: protocol for a randomised feasibility study.,"Home-based physiotherapy is a current approach to manage knee osteoarthritis (OA). However, adherence to physiotherapy is poor. Non-immersive virtual reality (VR) has shown promise in improving self-efficacy and adherence in other clinical conditions. A non-immersive VR-based home physiotherapy system named Sensor-based Physiotherapy Intervention with Virtual Reality (SPIN-VR) for knee OA has been developed, integrating physiotherapy exercises into engaging games that adjust in difficulty based on real-time performance. This approach aims to enhance exercise adherence by making physiotherapy more enjoyable and personalised. To evaluate the feasibility of this intervention, a randomised controlled trial is being conducted.",2025,BMJ open,10.1136/bmjopen-2025-102994,Mohammad Al-Amri; Samuel Bird; Denise-Teodora Nistor; Judith White; Kate Button; Martin Warner; David Walsh; Dione Shorten; Rose Evans
41124414,Tracheostomy care in the home environment: development of educational videos.,To develop educational videos on tracheostomy care for adults and the elderly in the home environment.,2025,Revista gaucha de enfermagem,10.1590/1983-1447.2025.20240366.en,Jade Alycia Ribeiro E Santos; Francis Jones São Victor de Jesus; Miguir Terezinha Vieccelli Donoso; Maria Célia Barcellos Dalri; Maria Helena Barbosa; Tania Couto Machado Chianca; Luciana Regina Ferreira Pereira da Mata; Aldenora Laísa Paiva de Carvalho Cordeiro
41120099,Impact of Sociodemographics and Home and Community-Based Services on the Wellbeing of Rural Caregivers of Children and Youth With Special Healthcare Needs: An Exploratory Study.,"Caregivers of children and youth with special healthcare needs (CYSHCN) often experience significant challenges accessing home and community-based services (HCBS), resulting in psychological distress, increased burden and decreased caregiver wellbeing. However, little is known about the associations between HCBS access and caregiver wellbeing in rural areas. Therefore, the purpose of this study was to (1) explore the associations between caregiver and child sociodemographic characteristics and HCBS access on caregiver wellbeing in a rural context and (2) add additional empirical support to an emerging theoretical framework.",2025,"Child: care, health and development",10.1111/cch.70168,Brad Phillips; Isabella Haynes; Asa Charnik
41116998,Feasibility and Usability of a Post-Hospital Behavioral Intervention to Improve Mobility in Veterans.,"The strongest risk factor for readmission to the hospital is impaired physical function. We sought to determine the usability and feasibility of a post-hospital behavioral intervention to improve mobility in older adults with significant morbidity and functional impairment. We conducted a two-arm pragmatic pilot randomized trial of a behavioral economics-informed intervention to increase daily steps in Veterans, age 60 or older, receiving home health (HH) services post-discharge. The intervention group received a multicomponent behavioral economics-informed intervention, including daily step count goals, performance feedback, social incentives, and a pedometer. The control group received usual care, which included the use of a pedometer without additional interventions. Both groups wore an ActivPAL device to continuously monitor activity. Outcomes were measured at 60 days post-discharge. The primary outcomes were feasibility (enrollment and completion rates) and usability (device compliance and participant satisfaction). Secondary outcomes included changes in mean daily steps and hospital utilization. Differences in daily steps between the intervention and control group were examined using a linear mixed effects model. Sixteen out of the 37 consented Veterans completed the study (9 intervention, 7 control). All Veterans rated as very satisfied with wearing the pedometer, while 3 did not like wearing the ActivPAL. The pedometer data was more complete, with a missing step data rate of 5%, compared to 29% for the ActivPAL. The median (interquartile range, IQR) baseline step counts were 926 steps (2744) in the control arm and 1131 steps (2952) in the intervention arm. Both groups increased steps during the intervention; however, there was no significant difference between groups (",2025,"Inquiry : a journal of medical care organization, provision and financing",10.1177/00469580251384787,Jacqueline A Benson; Matthew Wilson; Aidan J Flynn; Julie Stutzbach; Kimberly J Waddell; Robert E Burke
41112639,Understanding older adults' adoption of smart product-service systems for medication management in China: an extended UTAUT model approach.,"The rapid aging of China's population is intensifying the burden of chronic disease management and driving a shift toward home-based care supported by Smart Product-Service Systems (SPSS), such as smart pillboxes and medication management applications. However, the success of these technologies largely depends on their acceptance and use by older adults. This study aims to explore the behavioral factors influencing the adoption of SPSS for medication management among older adult users in China, using an extended Unified Theory of Acceptance and Use of Technology model. To better capture the complex interactions between the service delivery environment and users' personal capabilities and psychological states, the model incorporates three additional constructs: Self-Efficacy, Health Consciousness, and Medical Service Satisfaction. Structural Equation Modeling based on Partial Least Squares was employed to validate the model using empirical data collected from older adult respondents in China. The results show that Performance Expectancy, Effort Expectancy, Social Influence, Self-Efficacy, Health Consciousness, and Medical Service Satisfaction all significantly influence behavioral intention, whereas Facilitating Conditions did not demonstrate a significant effect. These findings highlight that, within the Chinese cultural context, family support and intrinsic health motivation are more critical than external infrastructure in shaping technology adoption. This study contributes to a deeper theoretical understanding of health technology adoption among older adults and offers practical insights for SPSS developers. It underscores the importance of culturally adapted and user-friendly smart systems to improve medication adherence and health outcomes in aging societies.",2025,Frontiers in public health,10.3389/fpubh.2025.1657473,Ruochen Fu; Xiaofei Ma
41108507,Eliciting Patient Preferences for the Hospital at Home Programme in Singapore; A Discrete Choice Experiment.,"Hospital overcrowding in Singapore has reached a critical level, primarily owing to an ageing population and an increased demand for medical services. Alternative care models such as hospital-at-home (H@H) programmes have been introduced to address this issue, utilising telehealth and home-based care. We conducted a choice experiment to determine the most preferred characteristics of a hospital-at-home programme in Singapore.",2025,The patient,10.1007/s40271-025-00780-4,Sanjeewa Kularatna; Low Lian Leng; Michelle Tan Woei Jen; Tang Woon Hoe; Tan Wee Boon; Lai Yi Feng; Nicholas Graves; Sameera Senanayake
41107599,"Patient-, care partner-, and clinician-proposed solutions to address the time toxicity of cancer care.","As the concept of time toxicity has gained traction in the oncology community, work has largely focused on mapping and measuring time burdens. This qualitative study sought to elicit perspectives from people with lived or professional experience with cancer care on strategies to decrease the time burden of oncology care.",2025,Supportive care in cancer : official journal of the Multinational Association of Supportive Care in Cancer,10.1007/s00520-025-09954-0,Whitney V Johnson; Sai S Valisekka; Obafemi O Ogunleye; Samuel X Stevens; Manju George; Allison Breininger; Michael Anne Kyle; Christopher M Booth; Timothy P Hanna; Rachel I Vogel; Helen M Parsons; Anne H Blaes; Arjun Gupta
41106427,Comparing Post-Acute Care Outcomes Between Home Health Care and Skilled Nursing Facilities: A Scoping Review.,"Skilled nursing facilities (SNFs) and home health care (HHC) are 2 primary settings for post-acute care (PAC). There is growing interest in shifting care from SNFs to lower-cost home-based care, which may also be preferred by patients and families due to a more patient-centered approach.",2025,Journal of the American Medical Directors Association,10.1016/j.jamda.2025.105926,Fangli Geng; Kailin Xu; Yuchen Liu; Olivia I Okereke; Sandra Shi
41104799,Parenting Process in Paediatric Palliative Care for Children With Cancer During Hospitalisation at Home: A Qualitative Study of the Maternal Experience.,"Paediatric palliative care (PPC) addresses the unmet needs of children with life-limiting conditions and their families. In France, PPC for children with cancer is regularly offered in hospital or the home setting, with families often stating a preference for home care. However, hospitalisation at home (HaH) poses significant parenting challenges for mothers, particularly in terms of emotional support, decision-making, and day-to-day care management.",2025,Scandinavian journal of caring sciences,10.1111/scs.70107,Voskan Kirakosyan; Matthieu Plichart; Fatima Laradji; Marie-Frédérique Bacqué
41101957,Examining the implementation of home-based palliative care for patients with end-stage liver disease (HoPE): a protocol for a feasibility study.,"Cirrhosis is a major cause of morbidity and mortality. Patients with decompensated cirrhosis, or end-stage liver disease (ESLD), have a high symptom burden and an increased mortality risk. Yet, the uptake of palliative care in patients with ESLD remains low and variable. Despite robust evidence of the value of home palliative care in other advanced diseases, this has not been well studied in patients with ESLD. Hence, the primary aim of this study is to explore the implementation, feasibility and acceptability of home palliative care in patients with ESLD and healthcare professionals. We also aim to describe its impact on the quality of life (QoL), mood, symptom burden, caregiver burden and healthcare utilisation of patients with ESLD.",2025,BMJ open,10.1136/bmjopen-2025-103784,Chung Yau Nah; WanFen Yip; Kalaiyarasi Kaliyaperumal; Sek Hwee Yung; Siew Chin Chia; Allyn Hum
41100338,Consensus Recommendations on Home Maintenance Nebulization with Focus on Obstructive Airway Diseases: An Update on Best Practices and Future Directions.,Asthma and chronic obstructive pulmonary disease (COPD) are obstructive airway diseases (OADs) that contribute significantly to the burden on healthcare systems in low- and middle-income countries like India.,2025,The Journal of the Association of Physicians of India,10.59556/japi.73.1195,Randeep Guleria; Sundeep Salvi; Pranav Ish; Agam C Vora; Aloke Ghoshal; Amit A Saraf; Anshuman Mukhopadhyay; Ashok K Taneja; Devendra P Singh; Debraj Jash; Girish Mathur; K Satish; Kamlesh Tewary; Mangesh Tiwaskar; Milind Y Nadkar; Nitin Abhyankar; R K Singal; Raja Dhar; Venkata Nagarjuna Maturu; Rm Pl Ramanathan
41099182,Role and Expectations of Family Caregivers in Hospital at Home in the US and Canada.,,2025,Journal of the American Geriatrics Society,10.1111/jgs.70167,David M Levine; Linda V DeCherrie; Annabel Steiner; Gabrielle Schiller; Albert Siu; Bruce Leff
41095815,Clinical Associations with Hospital Escalation Among COVID-19 Patients Receiving Remdesivir in a Hospital-at-Home Service: A Real-World Cohort Study.,,2025,Journal of clinical medicine,10.3390/jcm14196736,Manuel Mirón-Rubio; Regina de la Corte-Carmona; Amaya Palomo-Iloro; Eduardo Fernández-Carracedo; José Ramón Sevilla-Resúa; Santiago Somovilla-Moreno; Isabel Ortega-Fernández; Francisco Bas-Sanchís; María Del Carmen Montero-Hernández; Irene Gutiérrez-Gómez; Rocío Estepa-Sánchez; Eduardo Oliveros-Acebes
41094888,Smart Healthcare at Home: A Review of AI-Enabled Wearables and Diagnostics Through the Lens of the Pi-CON Methodology.,"The rapid growth of AI-enabled medical wearables and home-based diagnostic devices has opened new pathways for preventive care, chronic disease management and user-driven health insights. Despite significant technological progress, many solutions face adoption hurdles, often due to usability challenges, episodic measurements and poor alignment with daily life. This review surveys the current landscape of at-home healthcare technologies, including wearable vital sign monitors, digital diagnostics and body composition assessment tools. We synthesize insights from the existing literature for this narrative review, highlighting strengths and limitations in sensing accuracy, user experience and integration into daily health routines. Special attention is given to the role of AI in enabling real-time insights, adaptive feedback and predictive monitoring across these devices. To examine persistent adoption challenges from a user-centered perspective, we reflect on the Pi-CON methodology, a conceptual framework previously introduced to stimulate discussion around passive, non-contact, and continuous data acquisition. While Pi-CON is highlighted as a representative methodology, recent external studies in multimodal sensing, RFID-based monitoring, and wearable-ambient integration confirm the broader feasibility of unobtrusive, passive, and continuous health monitoring in real-world environments. We conclude with strategic recommendations to guide the development of more accessible, intelligent and user-aligned smart healthcare solutions.",2025,"Sensors (Basel, Switzerland)",10.3390/s25196067,Steffen Baumann; Richard T Stone; Esraa Abdelall
41094488,The impact of digital literacy on older adults' utilization of community-based home care services: a cross-sectional study.,"China has entered a stage of moderate aging, characterized by a ""90-7-3"" eldercare pattern: 90% of the older adults opt for home-based care, 7% utilize community-based care, and 3% reside in institutional care facilities. With the rapid development of the digital economy, innovative solutions such as smart eldercare devices and telemedicine have emerged, offering new possibilities to enhance the efficiency and quality of eldercare services. However, while benefiting from digital technologies, the older adults generally face challenges posed by the ""digital divide,"" making digital literacy a critical factor constraining the digital transformation of eldercare services.",2025,BMC health services research,10.1186/s12913-025-13427-9,Xueqing Xia; Mingbao Zhu
41094360,Utilization of dental services of older persons after onset of home care --- an observational study from the InSEMaP research project based on German insurance claims data.,"Maintaining a good oral health is important for general health, nutrition, and quality of life. Nevertheless, the utilization of dental services decreases with age. Persons in need of home care, in particular, might face difficulties organizing dental visits due to a decreasing functional status. The aim of this study was to analyze the utilization of dental services of older persons after the onset of need for home care.",2025,BMC geriatrics,10.1186/s12877-025-06420-8,Espen Henken; Hans-Helmut König; Alexander Konnopka; Anja Behrens-Potratz; Stefanie Schellhammer; Petra Schmage; Thomas Zimmermann; Claudia Konnopka
41089208,Rehabilitation Priorities and Employment Reintegration Among Individuals with Spinal Cord Injury Receiving Home-Based Care: A National Cross-Sectional Survey of Functional and Social Determinants.,"Spinal cord injury (SCI) individuals undergoing home-based rehabilitation face multiple challenges, including functional impairments, bladder dysfunction, and employment barriers. Poor bladder management impacts autonomy, health, and quality of life, while limited mobility and environmental inaccessibility hinder return-to-work.",2025,Patient preference and adherence,10.2147/PPA.S535765,Hongxia Pan; Mingfu Ding; Yue Yang; Jianmei Zhang; Liang Zhu; Quan Wei
41086946,"Infection prevention and control knowledge, attitudes, and practices among patients and informal caregivers in home-based care: A systematic review.","Infection prevention and control (IPC) remains a challenge in home-based care, a rapidly expanding care sector worldwide. Despite the central role of patients and informal caregivers, little is known about their knowledge, attitudes, and practices (KAP).",2025,American journal of infection control,10.1016/j.ajic.2025.10.005,Jingjing Shang; Ashley M Chastain; Margaret V McDonald; Jinjiao Wang; Ji Won Lee; Xuefan Ji; Bridget Morse-Karzen; David Russell
41086416,The Use of Technology to Deliver In-Home Aged Care Services: Mixed Methods Study of Australian Staff Perspectives.,"With a global aging population, technology has been proposed as a solution to address the growing demand for services in the in-home aged care sector. Despite the potential of technology, there are difficulties when implementing technology into routine care delivery. There is a lack of evidence regarding the specific factors affecting technology use in the in-home aged care setting from the perspective of the direct care workforce.",2025,JMIR aging,10.2196/76141,Baldwin Pok Man Kwan; Marissa Dickins; Sue Williams; Frances Batchelor; Kerry Hwang; Kate Fulford; Tony Walsh; Helena Jakupovic; Tanya E Davison
41084194,"Timely, Connected and Person-Centred: How the Integrated interRAI Reporting System is Supporting Senior Care in Canada.","The Integrated interRAI Reporting System (IRRS) supports timely, connected and person-centred senior care in Canada. IRRS enables system-to-system communication and near real-time data submission for the home care and long-term care sectors. It houses new interRAI data standards that offer improved commonality and standardization of language. With IRRS, users can explore organizational-level data, compare results across jurisdictions and see trends over time in a dynamic and user-friendly interactive business intelligence tool. IRRS will better support the sectors' ability to respond to emerging pan-Canadian needs to analyze, benchmark and compare data.",2025,"Healthcare quarterly (Toronto, Ont.)",10.12927/hcq.2025.27686,Phoebe Cheng
41083931,Understanding the patients' experience in Primary Technology Enhanced Care Home HbA1c Testing (PTEC HAT) programme-a qualitative study.,"Type 2 Diabetes Mellitus (T2DM) related healthcare expenditure is expected to rise drastically as the incidence of diabetes associated comorbidities increases. It is vital to maintain an optimum glycaemia for patients with diabetes to reduce the risk of diabetes complications. Given the strong predictive value for diabetes complications, HbA1c remains the gold standard to monitor glycaemic control in contemporary clinical practice. The Primary Technology Enhanced Care (PTEC) Home HbA1c Testing (HAT) Programme is a telehealth programme that is intended to empower low-risk patients to test their HbA1c independently at home, supported with tele-monitoring and review through teleconsultation, saving them up to three clinic visits per year. Given the programme's reliance on active patient involvement, understanding patient experiences within the programme to identify the enablers and barriers of using various PTEC HAT components is important for guiding iterative improvement and informing scale-up strategies.",2025,BMC primary care,10.1186/s12875-025-03034-2,Kah Pieng Ong; Elya Chen; Evonne Oh; Eng Sing Lee; Wern Ee Tang; David Wei Liang Ng; Valerie Teo
41083318,Improving Oral Health in Children With Disabilities: A Preventive Home-Based Care Model From Türkiye.,"Children with Special Health Care Needs (CSHCN) face significant challenges in maintaining oral hygiene and accessing dental services due to disabilities. It has been reported that, because of these disadvantages, individuals with special needs experience oral health problems at a higher rate compared to the general population. This study aimed to assess factors influencing oral health in CSHCN within the dental home framework and propose preventive strategies.",2025,"Child: care, health and development",10.1111/cch.70166,Esra Tunalı; Cafer Ataş; Yakup Çağ; Ahmet Lütfullah Orhan; Buğra Özen; Mustafa Aydınbelge; Mustafa Tunalı
