pmid,title,abstract,year,journal,doi,authors
41174684,Parent-guided home skin care for infants via a WeChat platform: a study protocol for a cluster randomized controlled trial.,"Diaper dermatitis and eczema are common skin conditions that affect infants with a high incidence rate. The prevention and management of these conditions largely depend on parents' adherence to appropriate home skin care practices, with the effectiveness of these practices closely linked to their accurate and consistent implementation. WeChat, a widely used messaging platform in China, has demonstrated potential in promoting health awareness and self-management strategies. We have developed a WeChat-based parent-guided home skin care scheme for infants, specifically designed to assist parents in managing the skin care of newborns. This study aims to evaluate the effectiveness of parent-guided home skin care administered via the WeChat platform in preventing diaper dermatitis and eczema in infants aged 0-6 months, using a clustered randomized controlled trial design.",2025,Trials,10.1186/s13063-025-09186-x,Tongling Yang; Yuying Chen; Yalan Dou; Mengfan Qiu; Yanchen Wang; Siyuan Jiang; Xiaojing Hu
41174337,A Multidisciplinary Hospital-at-Home Program in a Tertiary Singapore Hospital: A Comparative Study.,"Hospital-at-home (HaH) is an alternative care model that delivers acute, inpatient-level care in patients' homes and is well-established in Western countries. Given the unique challenges facing Asian healthcare systems, there is a need to evaluate the impact of HaH in this context.",2025,Journal of general internal medicine,10.1007/s11606-025-09900-0,Natalie Yingxian Ong; Shirley Xin Jin Chu; Milawaty Nurjono; Jin Wee Ng; Hong Choon Oh; Qin Yong See
41174222,"Adapting health, economic and social policies to address population aging in China.","Despite its rapid economic rise over the past four decades, China now grapples with the challenge of accommodating and supporting its expanding aging population. In 2020, 18% of its population were over age 60, and 2.5% were over age 80, projected to rise to 39% and 10%, respectively, by 2050. This demographic shift places China at the forefront of diverse individual, familial and societal challenges. Here, we review these challenges in the context of emerging breakthroughs in basic and translational research, shifts in healthcare paradigms, evolving socioeconomic and political dynamics, and policy innovations. We synthesize China's current policies toward promoting healthy longevity in the general population, focusing on social health insurance, long-term care insurance, community and home-based care and palliative care, as well as gerontological research, public health prevention, nutritional and medical interventions, while identifying strengths and gaps. Finally, we propose suggestions to promote a more inclusive, resilient and happier aging society within China's distinctive sociopolitical and cultural context.",2025,Nature aging,10.1038/s43587-025-00999-8,Evandro F Fang; Yuan Fang; Guobing Chen; He-Ling Wang; Jianying Zhang; Chenkai Wu; Jing Liao; Chenglong Xie; Xiaoting Liu; Kan Wang; Yang Liu; Guang Yang; Qian Wang; Long-Tao He; Jun Li; Hou-Zao Chen; Lin Kang; Yawen Jiang; Huanxing Su; Hong Jiang; Na He; Jun Tao; Sean Xiao Leng; Richard C Siow; Chunrong Liu; Hafiz T A Khan; Yuanli Liu; Hisaya Kato; Takashi Sasaki; Jong In Kim; Andrea Britta Maier; Lin Zhang; Lene Juel Rasmussen; Jean Woo; Jing Wu; Huachun Zou
41171627,Physician Perspectives on Home Health Implementation in South Korea: Challenges and Future Directions.,"South Korea's rapidly aging population necessitates alternative healthcare delivery models beyond its hospital-centric system. Home-based care has been widely recognized for its potential to enhance patient outcomes, reduce hospital burden, and provide cost-effective care. However, integrating home-based care into South Korea's healthcare system presents significant challenges.",2025,Journal of community health nursing,10.1080/07370016.2025.2577887,Dae Hyun Kim; Soojin Kim; Joo Hyung Kim
41170531,Piloting the MIND at Home Dementia Care Navigation Program in primary care.,"Persons living with dementia (PLWDs) have complex needs and high expenses, and primary care (PC) plays a key role in their care. However, few American PLWDs receive adequate care, and many have unmet but potentially modifiable dementia-related care needs. Embedding effective evidence-based care strategies into PC settings is an opportunity to reduce excess burden but remains rare. This study evaluated the feasibility and potential impact of adapting and implementing the MIND at Home Dementia Care Navigation Program (MIND at Home) into PC at two large unique health systems in the United States.",2025,"Alzheimer's & dementia (New York, N. Y.)",10.1002/trc2.70170,Elizabeth Ciemins; Stephen Shields; Halima Amjad; Monette McKinnon; Melissa Reuland; Mia Yang; Quincy Samus
41168511,Home-based treatment for patients with hematological cancer in Denmark-A national overview.,To investigate the extent and practice of home-based treatment for patients with hematologic malignancies in Denmark.,2025,Supportive care in cancer : official journal of the Multinational Association of Supportive Care in Cancer,10.1007/s00520-025-10048-0,Kristina Holmegaard Nørskov; Hanne Bødtcher; Tine Rosenberg; Camilla Thim Damgaard; Iben Husted Nielsen; Helle Enggaard; Susanne Oksbjerg Dalton
41167094,Home-based psychiatric hospitalization for children and adolescents during war times.,"Home-based psychiatric hospitalization (HBPH) has gained traction as a flexible alternative to inpatient care for adolescents with complex psychiatric conditions, but little is known about its feasibility when implemented rapidly during national crises. This retrospective study examined clinical outcomes and parental experiences following an emergency transition to HBPH during the Iran-Israel war. The sample included 22 adolescents (91% female, M_age = 15.15) with eating and other psychiatric disorders who were receiving care in inpatient or day hospital settings. Due to the two-week conflict, all participants were transitioned to a structured HBPH model combining remote clinical interventions (e.g., psychotherapy, psychiatric monitoring, nutritional support) with active parental involvement and local medical follow-up. Outcomes were assessed using clinician-rated (CGI-S, CGI-I), patient-reported (EDE-Q13), and parent-reported measures of self-efficacy, satisfaction, and treatment effectiveness. Results showed no clinical deterioration and moderate improvements in symptom severity and BMI. Parental self-efficacy was significantly associated with lower symptom burden and better clinical outcomes. While parents reported high satisfaction with the support provided by the clinical team, some expressed reservations about the broader applicability of the model, likely influenced by the sudden transition to home-based care. These findings suggest that HBPH, when supported by structured guidance and strong caregiver involvement, can be an effective alternative to institutional care even under emergency conditions. Moreover, the results highlight parental self-efficacy as a key therapeutic mechanism that may enhance treatment outcomes. This study adds to the growing evidence base supporting family-centered care models and offers insights for emergency mental health service planning.",2025,Psychiatry research,10.1016/j.psychres.2025.116788,Orly Lavan; Keren Fridwald; Amit Goldstein; Ori Laufer Laor; Avital Eberhard; Mira Horwitz; Nofar Valik; Tamar Tahar; Noa Benaroya-Milshtein
41164840,Utilization of home- and community-based services among rural family caregivers of persons with dementia: the role of the area deprivation index.,"Dementia significantly impacts rural communities in the U.S., presenting unique challenges for family caregivers due to limited access to essential support services. This study examines the influence of area-level factors on the utilization of home- and community-based services among rural caregivers.",2025,Frontiers in public health,10.3389/fpubh.2025.1688161,Jasmine Santoyo-Olsson; Kenneth E Covinsky; Jing Cheng; Dolores Gallagher Thompson; Veronica Yank
41164715,Out-of-Pocket Expenditure for HNF Palliative Care Among Cancer Patients in the Urban Centre of Hyderabad: A Cross-Sectional Study.,"Out-of-pocket expenditure (OOPE) remains a major barrier to accessing timely and quality palliative care services in India, particularly among low-income urban populations. Limited public funding for home-based palliative care further exacerbates the financial burden on families.",2025,Journal of pharmacy & bioallied sciences,10.4103/jpbs.jpbs_886_25,Shrikanth Muralidharan; Ram Devendra Gudgila; Ketaki Parimal Chaudhari; Madhuri Uttamrao Misal; Sushma Katkuri
41160539,Evaluating the sustainability and long-term outcomes of the Home Care Support Intervention Program (HoSIP) to reduce loneliness among community-dwelling older adults: A two-year follow-up study.,Understanding the long-term effects of home care support programs on loneliness in older adults is crucial for optimizing service delivery and improving the quality of life and care. This research explores the Sustainability and Long-Term Outcomes of the Home Care Support Intervention Program (HoSIP) to Reduce Loneliness among Community-dwelling Older Adults: A two-year follow-up study.,2025,PloS one,10.1371/journal.pone.0331987,Elham Lotfalinezhad; Shannon Freeman; Ahmad Kousha; Karen Andersen-Ranberg; Jeffrey E Stokes; Sama Amirkhani-Ardeh; Ahmad Sohrabi; Farzaneh Barati; Mina Hashemiparast; Mohammad Asghari-Jafarabadi; Mohammad Reza Honarvar; Haidar Nadrian
41160023,Postacute Care Use and Outcomes Among Medicare Advantage vs Traditional Medicare Beneficiaries.,"Postacute care expenditures exceed $57.3 billion annually for traditional Medicare (TM) and drive regional spending variation. Medicare Advantage (MA) plans, with financial incentives to optimize postacute care, offer a compelling alternative. With more than half of Medicare beneficiaries now enrolled in MA, understanding postacute care use and outcomes across these groups is increasingly critical for policy and practice.",2025,JAMA network open,10.1001/jamanetworkopen.2025.40347,Indrakshi Roy; Franya Hutchins; Liam Rose; Song Zhong; Syama R Patel; Amit Kumar; Rachel M Werner; Robert E Burke
41159520,Effect of home exercise programs in patients with non-tears rotator cuff-related shoulder pain: a systematic review and meta-analysis.,"Conservative treatment based on physiotherapy is the first option for non-tears rotator cuff related shoulder pain (RCSP). Although several studies demonstrate the positive effect of therapeutic exercise, aspects such as the influence of supervised exercises versus home-self training or the level of adherence are still unclear. The objective is to study the effect of home exercise programs compared to supervised exercise, either alone or combined with standard physiotherapy treatment.",2025,European journal of physical and rehabilitation medicine,10.23736/S1973-9087.25.08607-1,Sergio Hernández-Sánchez; José V Segura-Heras; Paula Andreu-Conde; Manuel Albornoz-Cabello; Luis Espejo-Antúnez; José V Toledo-Marhuenda
41159223,Introduction to XIV updating course of antimicrobials and infectious diseases.,,2025,Revista espanola de quimioterapia : publicacion oficial de la Sociedad Espanola de Quimioterapia,10.37201/req/s01.00.2025,Francisco Javier Candel; Mayra Matesanz
41151075,Two Gateways to Understanding the Health Workforce: Insights From Working With Organizational and Population-Level Data.,"Advancements in health workforce research depend on access to timely, detailed, and practically oriented data. Yet researchers in this field often encounter barriers to data access, which impacts the research that we are able to conduct. In this article, we share insights as researchers who have studied health workforces through a range of data sources accessed across traditional academic and embedded scientist roles. We concentrate on unique opportunities and limitations from two experiences: (1) use of Statistics Canada surveys as part of university-based studies and (2) health organization administrative data as embedded homecare scientists at VHA Home HealthCare. Collectively, these complementary data sources contribute to providing a more comprehensive advancement of our understanding of personal support workers in Canada. We hope that sharing insights from these experiences provides inspiration and guidance to others who want to pursue a similar path in health workforce research.",2025,Healthcare management forum,10.1177/08404704251361919,Katherine A P Zagrodney; Emily C King; Sandra M McKay
41149458,Parents' Experiences and Clinicians' Perceptions of Managing Cancer Pain in Young Children at Home.,"Pain is a prevalent and distressing symptom for children with cancer, negatively affecting quality of life and family functioning. While most research focuses on hospital-based care, many pain episodes occur at home, where parents act as primary caregivers with limited access to evidence-based symptom management. Young children are particularly vulnerable due to limited self-reporting capacity and reliance on parental assessment. We aimed to explore parent experiences and pediatric oncology clinician perceptions of young children's cancer pain at home, its impact on families, and recommended supports.",2025,"Current oncology (Toronto, Ont.)",10.3390/curroncol32100538,Lindsay A Jibb; Elham Hashemi; Surabhi Sivaratnam; Aimee K Hildenbrand; Paul C Nathan; Julie Chartrand; Nicole M Alberts; Tatenda Masama; Hannah G Pease; Lessley B Torres; Haydee G Cortes; Mallory Zworth; Susan Kuczynski; Michelle A Fortier
41148662,Outpatient Parenteral Antimicrobial Therapy in a Tertiary Hospital in France: A Description of Service Models and Costs.,,2025,"Antibiotics (Basel, Switzerland)",10.3390/antibiotics14100971,Espérie Burnet; Alicia Le Bras; Guillaume Roucoux; Christian Dupont; Etienne Canouï; Clément Leclaire; Jérémie Zerbit; Pierre Régis Burgel; Clémence Martin; Isabelle Durand-Zaleski; Martin Duracinsky
41148358,Indications for home mechanical ventilation in children: changes over four decades.,"Home mechanical ventilation (HMV) has been used for more than 40 years in the Netherlands. With this retrospective single-center study, we aimed to evaluate the demographics of children supported by HMV and changes in indications and type of support. We retrieved relevant data of all patients younger than 19 years who started HMV between 1979 and 2023 from a prospective database and from medical notes. A total of 544 children started with HMV (median age 13.1 years (IQR 5-16)). After a rapid increase between 1979 and 2017, the number of children treated with HMV stabilized. Nearly 40% of patients started HMV unplanned, because of failed weaning off the ventilator after surgery or an infection. Thirty percent of all children started with invasive ventilation. A majority of patients had a neuromuscular disorder (NMD) (n = 305, 56%) or a genetic syndrome (n = 85, 16%). The relative contribution of other diseases than NMDs increased in the 21th century. The relative number of patients younger than 5 years using HMV increased significantly over the years, from 13% in 1989-1998 to 30% in 2014-2022. This increase was even more pronounced for children using non-invasive ventilation (NIV), i.e. < 4% till 2003 and 30% in 2019-2022.",2025,European journal of pediatrics,10.1007/s00431-025-06559-x,Laura Verweij van den Oudenrijn; Michael Gaytant; Lieke Arts; Peter Wijkstra; W Ludo van der Pol; Esther Veldhoen
41143665,Bridging boundaries: a research consortium to advance hospital-at-home care delivery.,"The COVID-19 pandemic accelerated the adoption of the hospital at home (HAH) model, driven by the 2020 CMS Acute Hospital Care at Home waiver that removed financial barriers to reimbursement. With more than 330 hospitals across 130 health systems implementing HAH, this care model offers promising outcomes and experiences while addressing rising health care costs and an aging population. However, further research is needed to define its scalability, appropriate patient populations, and long-term viability. To address these gaps, Cleveland Clinic and Mayo Clinic established the Cleveland Clinic-Mayo Clinic (CCMC) Home-Based Care Research Consortium. The consortium focuses on creating a national registry, standardizing data, and developing evidence-based care pathways to evaluate the impact of HAH on patient safety, outcomes, and costs. Additionally, it aims to identify which populations and conditions can benefit most, ensuring equitable and high-quality care delivery. The consortium also prioritizes caregiver well-being, exploring virtual and hybrid models to address workforce challenges and enhance provider satisfaction. Recognizing health equity as essential, it emphasizes enrolling diverse populations and collaborating with community organizations to address social determinants of health. The consortium will also focus on true cost savings, workforce efficiency, and integration with home-based care programs, taking into account recent advances in technology and artificial intelligence. By fostering collaboration and rigorous research, the CCMC Consortium seeks to refine HAH into a scalable, sustainable, and equitable care model that meets the evolving demands of modern health care.",2025,The American journal of managed care,10.37765/ajmc.2025.89809,Jessica A Hohman; Richard D Rothman; Michael J Maniaci
41143560,Perspectives of stroke survivors and informal caregivers on home-based mental practice for upper limb recovery after stroke: a qualitative co-design study.,"In this qualitative study, we explored the views of stroke survivors and informal caregivers regarding three types of mental practice for upper limb recovery: (1) action observation (AO); (2) motor imagery (MI); and (3) combined action observation and motor imagery (AO + MI). Semi-structured interviews and focus groups were conducted between December 2021 and October 2022 with 23 participants (13 caregivers and 10 stroke survivors).Thematic analysis generated three higher-order themes: ",2025,Neuropsychological rehabilitation,10.1080/09602011.2025.2577376,Dan Lin; Daniel Lloyd Eaves; Tom Gibbons; Maria Raisa Jessica Ryc Aquino; Martin Gareth Edwards; Ellen Poliakoff; Judith Bek; Jonathan Reyes Emerson
41136346,Quality-of-life factors at home and in health care settings for people living with dementia.,"Person-centered ""home time"" measures track time spent in health care versus home using claims data. These measures can indicate patient preferences, quality of care, or quality of life. However, for people living with dementia, these measures lack input from them and their care partners about the impact of different settings. This study explored quality of life factors for them at home and in health care settings.",2025,The Gerontologist,10.1093/geront/gnaf196,Nathan A Boucher; Justine Seidenfeld; Kevin C McKenna; Alli Bosquet; Sahar Shibeika; Judith S Vick; James R Burke; Brenda L Plassman; Cassandra M Dictus; Megan Shepherd-Banigan; Brystana G Kaufman; Valerie A Smith; S Nicole Hastings; Courtney H Van Houtven
41136083,Home Mechanical Ventilators: Indications for Use in Chronic Respiratory Failure.,"Home mechanical ventilators (HMV) are positive pressure devices that allow patients with chronic respiratory failure to live in the comfort of their own homes. HMV are more advanced than standard respiratory assist devices, providing features including internal and external batteries for daytime use outside the house, unique modes such as volume-assured pressure support with auto expiratory positive airway pressure and mouthpiece ventilation, and more alarms to provide safety for patients with severe disease. The process of prescribing HMV in the United States can be complex.",2025,Sleep medicine clinics,10.1016/j.jsmc.2025.07.004,Jose Victor Jimenez; Philip J Choi
41136078,From Inpatient to Home: Optimizing Transitions of Care for Patients on Long-Term Noninvasive Ventilation.,"Noninvasive ventilation (NIV) is widely accepted as an intervention that helps patients with cardiopulmonary diseases and sleep-related breathing disorders transition from hospital to home. NIV can alleviate symptoms, normalize arterial blood gases, improve health-related quality of life, reduce hospital readmissions, and mortality in certain patient groups. However, reimbursement constraints and the lack of standardized discharge pathways may compromise the effectiveness of this process and the quality of care in this fragile population.",2025,Sleep medicine clinics,10.1016/j.jsmc.2025.07.013,Fernando Figueroa Rodriguez; Alfredo Selim; Bernardo Selim
41132177,Construction of community home-based older adult care service model based on modular design concept.,To address the supply-demand mismatch in community home-based older adult care services amid China's deepening aging population crisis.,2025,Frontiers in public health,10.3389/fpubh.2025.1672918,Xiaohua Zhou; Lina Chen; Xu Lou; Ying Li; Bobo Han
41131522,Palliative care conditions managed at home and self-reported challenges experienced by informal home-based caregivers in Rwanda: a qualitative study.,"A greater dependency on informal home-based caregivers to assist patients in their homes stems from Rwanda's rising palliative care needs and the burden of terminal illnesses. These caregivers play a critical role in addressing patients' physical and emotional needs and assisting with daily activities. However, in low-resource settings like Rwanda, limited attention has been given to understanding their lived experiences and the challenges they face. This study primarily aimed to explore the lived experiences and caregiving challenges of informal home-based caregivers providing palliative care. A secondary aim was to describe the range of life-threatening conditions being managed at home under their care.",2025,BMC palliative care,10.1186/s12904-025-01905-0,Jean Claude Twahirwa; Madeleine Mukeshimana; Margaret Fitch; Godfrey Katende
41131177,The Impact of Coping and Psychological Flexibility on Young Adult Caregivers' Mental Health and Quality of Life.,"As the emphasis on home-based care grows, it is important to understand factors that affect caregivers' quality of life (QOL). Despite the rise of caregiving responsibilities among all demographics, limited literature examines young adult caregivers. The purpose of this study was to 1) examine the difference in mental health (MH) and QOL among young adult caregivers (YAC) and non-caregivers (YANC) and 2) explore how coping and psychological inflexibility moderate the association of caregiver status with MH and QOL. 60 YAC and YANC (age 18-29) were matched via a one-to-one nearest-neighbor propensity score matching with a caliper of 0.1. Participants completed a questionnaire measuring depression and anxiety, QOL, psychological inflexibility, and coping. ANCOVA revealed YAC reported lower physical health-related QOL than YANC (η",2025,The journal of behavioral health services & research,10.1007/s11414-025-09976-w,Alice Ahn; Taylor Eldridge; Debbie Torres; Chelsea Ratcliff
41130682,Prehabilitation of frail elderly PAtients undergoing majoR surgEry at HOME (PREPARE-HOME): a superiority parallel-group randomised controlled trial protocol evaluating smart wearable enhanced prehabilitation versus usual care.,"Frailty is a key predictor of adverse surgical outcomes in older adults, contributing to increased postoperative complications, prolonged hospitalisation and delayed recovery. Prehabilitation-targeting improvements in physical function before surgery-can mitigate these risks. However, traditional programmes often face low adherence due to logistical barriers. Integrating smart wearable devices into tele-supervised, home-based prehabilitation may enhance adherence, engagement and clinical outcomes.This trial protocol describes the PREhabilitation of frail elderly PAtients undergoing majoR surgEry at HOME study with the objective to evaluate the effectiveness of a wearable-enhanced, tele-supervised prehabilitation programme (swSEP) versus standard care (unsupervised prehabilitation, uSEP) on improving preoperative functional capacity and postoperative outcomes in frail older adults undergoing major elective surgery.",2025,BMJ open,10.1136/bmjopen-2024-094986,Yun Hao Leong; Victoria Yu Jia Tay; XinYi Yang; Chun Ju Tan; Phui-Sze Au-Yong; Jacqueline Ling Xiu Sim; Roderica Rui Ge Ng; Marcus Eng Hock Ong; Brenda Pei Yi Tan; Hairil Rizal Abdullah; Yuhe Ke
41127918,Home-based psilocybin-assisted therapy for a patient with advanced cancer: A case report.,"Psychospiritual distress affects many patients with cancer, contributing to diminished quality of life, decreased survival and a desire for hastened death. The current standard of care, which primarily consists of antidepressants and psychotherapy, has demonstrated only modest benefits. Psilocybin-assisted therapy (PAT) has shown evidence of rapid, durable, and significant effects on measures of both depression and anxiety in this patient population.",2025,Palliative & supportive care,10.1017/S1478951525100941,Houman Farzin; Benjamin Koren; Héléna Ferrier; Justin J Sanders; Nicolas Garel
