pmid,title,year,doi,cost_per_test,sensitivity,specificity
41176393,"Innovations in the biomedical prevention, diagnosis, and service delivery of HIV and other sexually transmitted infections.",2025,10.1016/S0140-6736(25)00983-3,,,
41175874,Genomic copy-number variants drive apoptotic evasion underlying acquired resistance to immune checkpoint inhibitors.,2025,10.1016/j.immuni.2025.10.001,,,
41171396,"Interventional effects of targeted anti-infective therapy on disease severity and inflammatory cytokine levels in critically Ill patients with urinary sepsis in tertiary hospitals in Chongqing, China.",2025,10.1007/s00210-025-04693-9,,,
41170688,A CRISPR/Cas12a-based aptasensor enhanced by functionalized AuNPs for sensitive full-range C-reactive protein detection.,2025,10.1039/d5tb01727k,,,
41170250,Predictive Value of C-Reactive Protein/Albumin Ratio in Acute Pancreatitis.,2025,10.7759/cureus.93436,,55,55
