study_id,year,country,population,intervention,sensitivity,specificity,cost_per_test,time_to_result,antibiotic_stewardship_outcomes,icer,notes
41176393,2025,India,Infectious disease patients,AMR POCT stewardship,,,,,,,"Data from PubMed: Innovations in the biomedical prevention, diagnosi..."
41175874,2025,India,Infectious disease patients,AMR POCT stewardship,,,,,,,Data from PubMed: Genomic copy-number variants drive apoptotic evasi...
41171396,2025,India,Infectious disease patients,AMR POCT stewardship,,,,,,,Data from PubMed: Interventional effects of targeted anti-infective ...
41170688,2025,India,Infectious disease patients,AMR POCT stewardship,,,,,,,Data from PubMed: A CRISPR/Cas12a-based aptasensor enhanced by funct...
41170250,2025,India,Infectious disease patients,AMR POCT stewardship,55.0,55.0,,,,,Data from PubMed: Predictive Value of C-Reactive Protein/Albumin Rat...
